{
  "output_schema": 1,
  "mode": "dry-run",
  "outcome": "planned",
  "assessment": {
    "output_schema": 1,
    "status": "ready",
    "source": {
      "framework_version": "v0.7.0",
      "package": {
        "id": "hegira-canonical",
        "version": "v0.7.0"
      }
    },
    "target": {
      "framework_version": "v0.8.0",
      "package": {
        "id": "hegira-canonical",
        "version": "v0.8.0"
      }
    },
    "composition": {
      "components": [
        {
          "id": "layered-base",
          "version": "v0.7.0"
        },
        {
          "id": "layered-leptos-identity",
          "version": "v0.7.0"
        }
      ],
      "modules": [
        {
          "id": "identity",
          "version": "v0.7.0"
        }
      ],
      "capabilities": [
        "authentication",
        "authorization"
      ],
      "databases": [
        "sqlite"
      ],
      "clients": [
        "leptos"
      ]
    },
    "recovery": "pass",
    "managed_boundaries": "pass",
    "diagnostics": []
  },
  "plan": {
    "schema": 1,
    "edge": "v0-7-0-to-v0-8-0",
    "source": {
      "framework_repository": "https://github.com/furkancemalcaliskan/hegira.git",
      "framework_version": "v0.7.0",
      "package": "hegira-canonical",
      "package_version": "v0.7.0"
    },
    "target": {
      "framework_repository": "https://github.com/furkancemalcaliskan/hegira.git",
      "framework_version": "v0.8.0",
      "package": "hegira-canonical",
      "package_version": "v0.8.0"
    },
    "source_package_digest": "sha256:34ddf6356d441791c93f306f5ea6aeb5927cab1062d2e6d7f8b8928ee198b053",
    "source_baseline_digest": "sha256:aecfa2a171e8eb760d62041ae76350f00ae4b10be35f9cec580b60f56b5812c5",
    "manifest_transitions": [
      "framework",
      "package",
      "components",
      "modules",
      "ownership"
    ],
    "framework_dependencies": [
      "audit",
      "background_jobs",
      "cache",
      "configuration",
      "http_support",
      "identity_application",
      "identity_application_contracts",
      "identity_domain",
      "identity_domain_shared",
      "identity_http",
      "identity_leptos",
      "identity_sqlx",
      "leptos_support",
      "mail",
      "observability",
      "persistence",
      "platform_core",
      "runtime",
      "search",
      "security",
      "settings",
      "storage"
    ],
    "target_components": [
      "layered-base",
      "layered-leptos-identity"
    ],
    "target_modules": [
      "identity"
    ],
    "changes": [
      {
        "path": "Cargo.lock",
        "operation": "edit",
        "component": "layered-leptos-identity",
        "integration": "framework-lockfile",
        "ownership": "managed-integration",
        "precondition": {
          "kind": "matches-digest",
          "sha256": "e10876086dddb27e5c931ae5512c937ac226e954a845492d9dcac15debbb0e00"
        },
        "result": {
          "kind": "present",
          "sha256": "74256f83ff872aeb2117a9fb23b403e64c841cd218cf6376646d1fcc9441d1b2"
        }
      },
      {
        "path": "Cargo.toml",
        "operation": "edit",
        "component": "layered-leptos-identity",
        "integration": "framework-dependencies",
        "ownership": "managed-integration",
        "precondition": {
          "kind": "matches-digest",
          "sha256": "1f348942804ea524f7a2899c67382ee0af899e84dcc4011699e893cf02e1bd5f"
        },
        "result": {
          "kind": "present",
          "sha256": "e178991a9ac4f45d5f3dbc2f2b278104c86f5e91e10874ecbe09a8d95cbed7ba"
        }
      },
      {
        "path": "crates/infrastructure/src/database_operations.rs",
        "operation": "create",
        "component": "layered-leptos-identity",
        "integration": "database-operations",
        "ownership": "managed-integration",
        "precondition": {
          "kind": "absent"
        },
        "result": {
          "kind": "present",
          "sha256": "9ed801e060a0c53a79c69bdb8353971c329d00fdef4199fa8460d8b7a6f287d3"
        }
      },
      {
        "path": "hegira.toml",
        "operation": "edit",
        "component": "layered-base",
        "integration": "application-manifest",
        "ownership": "managed-integration",
        "precondition": {
          "kind": "matches-digest",
          "sha256": "def65e49a41b74200c3e659a8139392549f1bed30680250cb1cb409c3be1415f"
        },
        "result": {
          "kind": "present",
          "sha256": "cca1ab245bb2223348db849c29d26976876b2ca540eb306f9461709cdc840c1d"
        }
      }
    ]
  },
  "preserved_boundaries": [
    "application-owned",
    "generated-once",
    "immutable-history"
  ]
}
